167,MLS Listing,,Vacant Land,324th St NW,Stanwood,WA,98292,145000.0,0,2.74247311827957,Brandstrom,2756.496788008565,249598.0,2018.0,103.0,343.97072072072075,139.66666666666666,Active,0,0,http://www.redfin.com/WA/Stanwood/324th-St-NW-98292/unit-55xx/home/22091499,NWMLS,1242453,N,Y,48.289798,-122.28504299999999,"Mostly flat sunny pature with a high spot for possible building site, in a neighborhood of hobby farms and equestrian properties. Close to I-5 for commuters, 10 mins to Stanwood, 15 mins to Mount Vernon, 25 mins to Everett and 45 mins to Seattle. Hiking biking and horse trails nearby. Electricity in the street and property has a survey.",167
168,MLS Listing,,Mobile/Manufactured Home,4430 State Route 532,Stanwood,WA,98292,1250000.0,3,2.0,Stanwood,1782.0,1013641.0,2018.0,119.0,701.0,139.66666666666666,Active,0,0,http://www.redfin.com/WA/Stanwood/4430-Washington-532-98292/home/2606144,NWMLS,1236253,N,Y,48.234004999999996,-122.2930529,"Possibilities are endless on 23.27 acres! Right off 532 - there is tons of traffic but home/land are set back off the highway, can be as visible as you want. Build your dream home w/ a view? Additional zoning possibilities??? Buyers to verify with county. Live in many. hm while you build. This property is 5 minutes off I-5 and only minutes to downtown Stanwood & Camano Island. Bring your ideas - Make us an offer! 4yr old roof.",168
169,MLS Listing,,Single Family Residential,6514 278th St NW,Stanwood,WA,98292,424900.0,4,2.5,Cedarhome,2088.0,5000.0,2018.0,125.0,203.0,17.0,Active,0,0,http://www.redfin.com/WA/Stanwood/6514-278th-St-NW-98292/home/144713505,NWMLS,1233999,N,Y,48.2478506,-122.32594499999999,"New Construction is back in Stanwood! The Marble - Lot 16, a 4 Bed 2.5 Bath, 3 car garage 2 Story w/ quality standard features such as double oven ranges, pot fillers over stove top, tiled b/s from counter to cabinet, granite c/t's in kitchens & baths, front & rear landscaping, upgraded lighting package, engineered hardwood & MUCH more! Double door entry to master bedroom with coffered ceiling and 2 walk-in closets! Be one of the first to buy in Phase One!",169
170,MLS Listing,,Single Family Residential,16230 80th Ave NW,Stanwood,WA,98292,554950.0,3,2.5,Kayak Point,2260.0,54465.0,2018.0,130.0,246.0,42.0,Active,0,0,http://www.redfin.com/WA/Stanwood/16230-80th-Ave-NW-98292/home/144671692,NWMLS,1228588,N,Y,48.241758600000004,-122.3411721,"Back on the market! Builder cleared and flatten lots! Come check out the new views directly to the golf course! 1.25 acres which is great for building additional building. 9ft ceilings, masonry FP, quartz counter top, extensive use of tile, 3 bedroom plus office. Huge extensive covered and uncovered deck. Tile shower, soaking tub with great view, all bedrooms with walk in closets. Over six acres of open space, 5 piece master bath, stainless steel appliances.",170
171,MLS Listing,,Single Family Residential,16232 80th Ave NW,Stanwood,WA,98292,559950.0,4,2.5,Kayak Point,2433.0,44272.0,2018.0,130.0,230.0,42.0,Active,0,0,http://www.redfin.com/WA/Stanwood/16232-80th-Ave-NW-98292/home/144671409,NWMLS,1228594,N,Y,48.241758600000004,-122.3411721,"Back on the market after the builder flatten and cleared the lot and surrounding property to give you direct views of the golf course! This gorgeous 1 acre building site is perfect for the shop you always wanted. 9ft ceilings, masonry FP, quartz counter top, extensive use of tile, 4 bedroom plus office. Over six acres of open space, 5 piece master bath, stainless steel appliances, covered breeze-way great for BBQ-ing.",171
172,MLS Listing,,Vacant Land,46 xx Lot D 192nd St,Stanwood,WA,98292,138500.0,0,2.74247311827957,Happy Valley,2756.496788008565,48787.0,2018.0,141.0,343.97072072072075,139.66666666666666,Active,0,0,http://www.redfin.com/WA/Stanwood/46-XX-Lot-D-192nd-St-98292/home/28606621,NWMLS,1229126,N,Y,48.169835,-122.295148,"This beautiful level & wooded 1.2 acre parcel provides the perfect setting for your dream home. Convenient location for commuting, yet a rural feel that is rare to find. Ok for manufactured or stick built home.",172
173,MLS Listing,,Single Family Residential,4509 290th St NW,Stanwood,WA,98292,749000.0,3,3.0,Cedarhome,3923.0,202118.0,2018.0,164.0,191.0,139.66666666666666,Active,0,0,http://www.redfin.com/WA/Stanwood/4509-290th-St-NW-98292/home/2855716,NWMLS,1222061,N,Y,48.259363799999996,-122.2939902,"Luxurious home on 4.64 acres has privacy, pond, 3 car garage and addtl, 1+ garage, huge under house space with wine storage and entertainers deck overlooks pond. Inside boasts, hardwood floors, 2 double fireplaces, slab granite, tile, solid 6 panel doors and oak raised panel cabinets. Stainless appliances and propane 5 burner cooktop. Formal and informal living/family and dining rooms. Above the garage a DREAM ROOM for gatherings, parties, possible MIL, w/ outside entrance and bath. Wine room",173
174,MLS Listing,,Single Family Residential,16927 61st Dr NW,Stanwood,WA,98292,621000.0,4,2.75,Lake Goodwin,3023.0,38000.0,2018.0,192.0,205.0,60.0,Active,May-23-2018 10:00 AM,May-23-2018 06:00 PM,http://www.redfin.com/WA/Stanwood/16927-61st-Dr-NW-98292/home/144287541,NWMLS,1213490,N,Y,48.1506046,-122.3157925,"PRE-SALE- PHOTOS REFLECT typical finish work ONLY- Welcome to Wild Ridge! This community features 69 beautiful home sites in a serene neighborhood. Very near Lake Goodwin and Kayak Point golf course. Master BR includes 5 piece bath, Hardwood flrs, granite counters. SS appliances, built in micro, under mount SS sinks, Landscaping- 2-10 Warranty Included. EST COMPLETION end April - Pics reflect typical finishes * PLS NOTE: Zillow and Redfin maps are incorrect-View MLS listing for driving directions",174
175,MLS Listing,,Single Family Residential,6519 278th St NW,Stanwood,WA,98292,429900.0,4,2.5,Cedarhome,2088.0,5000.0,2018.0,195.0,206.0,17.0,Active,0,0,http://www.redfin.com/WA/Stanwood/6519-278th-St-NW-98292/home/144274282,NWMLS,1215760,N,Y,48.2482677,-122.325225,"New Construction is back in Stanwood! The Marble - Lot 7, a 4 Bd 2.5 Bth 2 Story with quality standard features such as double oven ranges, pot fillers over stove top, tiled b/s from counter to cabinet, granite c/t's in kitchens and baths, garage door openers and keypads, front and rear landscaping, upgraded lighting package, engineered hardwood and much more! Upgrades in this home include floor to ceiling stone fireplace, gas range and a stainless steel farm sink in the kitchen!",175
176,MLS Listing,,Vacant Land,1 Lot 3 296th St NE,Stanwood,WA,98292,389000.0,0,2.74247311827957,Victoria Heights,2756.496788008565,420789.0,2018.0,227.0,343.97072072072075,139.66666666666666,Active,0,0,http://www.redfin.com/WA/Stanwood/1-Lot-3-296th-St-NE-98292/home/144001064,NWMLS,1204101,N,Y,48.26425,-122.22587,No Description,176
177,MLS Listing,,Vacant Land,1 Lot 1 296th St NE,Stanwood,WA,98292,349000.0,0,2.74247311827957,Victoria Heights,2756.496788008565,395960.0,2018.0,227.0,343.97072072072075,139.66666666666666,Active,0,0,http://www.redfin.com/WA/Stanwood/1-Lot-1-296th-St-NE-98292/home/144000996,NWMLS,1204026,N,Y,48.264258,-122.218181,No Description,177
178,MLS Listing,,Vacant Land,18923 98th,Stanwood,WA,98292,30000.0,0,2.74247311827957,Warm Beach,2756.496788008565,13504.0,2018.0,234.0,343.97072072072075,139.66666666666666,Active,0,0,http://www.redfin.com/WA/Stanwood/18923-98th-Ave-NW-98292/home/143944700,NWMLS,1201316,N,Y,48.1684106,-122.36577050000001,No Description,178
179,MLS Listing,,Vacant Land,18921 98th,Stanwood,WA,98292,75000.0,0,2.74247311827957,Warm Beach,2756.496788008565,22651.0,2018.0,234.0,343.97072072072075,139.66666666666666,Active,0,0,http://www.redfin.com/WA/Stanwood/18921-98th-Ave-NW-98292/home/143944656,NWMLS,1201315,N,Y,48.1683843,-122.36577050000001,No Description,179
180,MLS Listing,,Vacant Land,189 Clarence,Stanwood,WA,98292,75000.0,0,2.74247311827957,Warm Beach,2756.496788008565,27443.0,2018.0,234.0,343.97072072072075,139.66666666666666,Active,0,0,http://www.redfin.com/WA/Stanwood/189-Clarence-Ave-98292/home/143944643,NWMLS,1201312,N,Y,48.168324,-122.364671,No Description,180
181,MLS Listing,,Vacant Land,28304 Old 99 N,Stanwood,WA,98292,975000.0,0,2.74247311827957,Stanwood,2756.496788008565,1742400.0,2018.0,237.0,343.97072072072075,139.66666666666666,Active,0,0,http://www.redfin.com/WA/Stanwood/28304-Old-99-N-98292/home/143922375,NWMLS,1197602,N,Y,48.2526654,-122.2566379,"Price to Sell Now!View Acreage! 2 Parcels total 42.93 acres with Olympic and Cascade views. R5 zoning to build up to 8 new homes on 40 acres and 1 on the 2.93, totaling 9 homes. Marketable timber on acreage, power in street on Old 99 N. Shared easement is located to backside of 40 acres and access from 2.93 acres off old HWY 99 N. Close to amenities of Stanwood. Easy access off I-5 to Stanwood & Camano, Seattle and Bellingham.",181
182,MLS Listing,,Vacant Land,7315 284th St NW,Stanwood,WA,98292,650000.0,0,2.74247311827957,Cedarhome,2756.496788008565,131551.0,2018.0,356.0,343.97072072072075,139.66666666666666,Active,0,0,http://www.redfin.com/WA/Stanwood/7315-284th-St-NW-98292/home/2544764,NWMLS,1133928,N,Y,48.254812,-122.33238899999999,"Huge development potential. Slightly sloped 3.02 acres of dry land in Stanwood's Cedarhome area. Water, gas and sewer stubbed at property line. Property is zoned 9600 min size. If you develop to cottage retirement criteria you could go many more units per acre. Talk to city planner for exactly what the options are. Views of mountains. No floodplain, close to shopping and schools. Seller lives on property, appointment only.",182
183,MLS Listing,,Vacant Land,19400 94th Dr,Stanwood,WA,98292,57500.0,0,2.74247311827957,Warm Beach,2756.496788008565,7509.0,2018.0,405.0,343.97072072072075,139.66666666666666,Active,0,0,http://www.redfin.com/WA/Stanwood/19400-94th-Dr-NW-98292/home/113710710,NWMLS,1103863,N,Y,48.1722236,-122.3606824,No Description,183
184,MLS Listing,,Single Family Residential,8405 Boe Rd,Stanwood,WA,98292,499950.0,3,1.0,Stanwood,1574.0,1380852.0,2018.0,413.0,318.0,139.66666666666666,Active,0,0,http://www.redfin.com/WA/Stanwood/8405-Boe-Rd-98292/home/113652489,NWMLS,1099363,N,Y,48.214634999999994,-122.35081000000001,"Farm house with large barn is on 31.70 acres! Great soils and lots of privacy. The farm house could be made a show piece. The large barn is in good shape with great timber. There are lots of possibilities, close to town, and parks. Please note there are two tax account numbers: 32043100300600 and 32043100300300",184
185,MLS Listing,,Single Family Residential,19381 County Line Rd,Stanwood,WA,98292,1495000.0,5,3.75,Mount Vernon,6698.0,1844766.0,2018.0,425.0,223.0,139.66666666666666,Active,0,0,http://www.redfin.com/WA/Stanwood/19381-County-Line-Rd-98292/home/16944174,NWMLS,1092888,N,Y,48.29759779999999,-122.3272892,"Make this home your sanctuary! Outstanding views of Skagit Bay on 42+ acres of farmland, gardens, woods and stream. Classic farmhouse with a 1990 addition includes 5 beds, 4 1/2 baths, Formal Living Room, Dining Room, Library and stunning staircase to a well-lit loft. Tranquil grounds include 100 year old equestrian barn, zen gardens with a heated koi pond, waterfalls and gazebo, plus a walking trail to the creek. A must see home!",185
186,MLS Listing,,Ranch,11203 State Route 532,Stanwood,WA,98292,2000000.0,0,2.74247311827957,Lakewood,4044.0,8130474.0,2018.0,616.0,495.0,139.66666666666666,Active,0,0,http://www.redfin.com/WA/Stanwood/11203-Washington-532-98292/home/108995384,NWMLS,1027977,N,Y,48.2406616,-122.38261920000001,"This listing presents a rare opportunity to purchase this prime farmland property on the banks of the Stillaguamish River and Skagit Bay. This property has been owned and operated by the Johnson Family since the early 1940s. The farm sale includes 186.65 acres of prime farmland, a two story single family residence, and accessory dwelling unit and 7 farm related structures. This property offers Buyers an amazing opportunity to own a piece of Stanwood's farming history.",186
187,MLS Listing,,Vacant Land,5 204th St NW,Stanwood,WA,98292,399995.0,0,2.74247311827957,Stanwood,2756.496788008565,1652231.0,2018.0,664.0,343.97072072072075,139.66666666666666,Active,0,0,http://www.redfin.com/WA/Stanwood/5-204th-St-NW-98292/home/108448558,NWMLS,1004399,N,Y,48.181067999999996,-122.26110800000001,"Beautiful, mostly level acreage is ready for developing, possibly 10 lot cluster home development. Great opportunity in a very private setting. Don't let this one pass you by!",187
188,MLS Listing,,Vacant Land,27212 28th Ave NW,Stanwood,WA,98292,1500000.0,0,2.74247311827957,East Stanwood,2756.496788008565,1310284.0,2018.0,784.0,343.97072072072075,139.66666666666666,Active,0,0,http://www.redfin.com/WA/Stanwood/27212-28th-Ave-NW-98292/home/2576140,NWMLS,915857,N,Y,48.244654,-122.271748,"Attention builders!Very nice 8 lot subdivision w/ final plat approval. 30 acres. 7 one acre lots have beautiful settings & are perked for 4 bedroom septics. PUD, phone, cable all underground. Seller is installing a community well for all lots. One lot has existing daylight basement home on 1.49 acre. Built in 1984,3440 sq ft, detached garage/office/shop & new horse barn w/ 4 stalls. You can't get a better location than this. Just 1.5 miles West of I-5 exit 212.",188
189,MLS Listing,,Vacant Land,19400 93rd Dr,Stanwood,WA,98292,33000.0,0,2.74247311827957,Warm Beach,2756.496788008565,6098.0,2018.0,976.0,343.97072072072075,139.66666666666666,Active,0,0,http://www.redfin.com/WA/Stanwood/19400-93rd-Dr-NW-98292/home/100386836,NWMLS,849754,N,Y,48.171918299999994,-122.359684,"Two Lots with partial water views. Community Water, Electricity in street, septic inspection shows possible 2 or 3 bedroom allowance. Great area near Warm Beach. Walk to water & trails. Platted area with easy convenience to freeways, shopping, schools and hospitals.",189
190,MLS Listing,,Vacant Land,30210 State Route 9 NE,Arlington,WA,98223,165000.0,0,2.74247311827957,Bryant,2756.496788008565,591109.0,2018.0,1194.0,343.97072072072075,139.66666666666666,Active,0,0,http://www.redfin.com/WA/Arlington/30210-Washington-9-98223/home/52431842,NWMLS,742654,N,Y,48.270617,-122.17618700000001,"Private 13.5 acres ""estate style"" property off SR9 featuring mature evergreens, creek frontage, park-like setting, nature abounds, driveway permitted and installed, backs to Centennial Trail and former Pilchuck Tree Farm -potentially dividable. Corners flagged and easy 10-15 minute drive to I-5 from Bryant Store.",190
191,MLS Listing,,Vacant Land,46 XX Lot C 192nd St,Stanwood,WA,98292,138500.0,0,2.74247311827957,Happy Valley,2756.496788008565,48787.0,2018.0,2903.0,343.97072072072075,139.66666666666666,Active,0,0,http://www.redfin.com/WA/Stanwood/26910-92nd-Ave-NW-98292/home/28606089,NWMLS,85875,N,Y,48.2410035,-122.3595082,"This beautiful level & wooded 1.2 acre parcel provides the perfect setting for your dream home. Convenient location for commuting, yet a rural feel that is rare to find. Ok for manufactured or stick built home.",191
192,For-Sale-by-Owner Listing,,Single Family Residential,28107 85th Dr NW,Stanwood,WA,98292,435000.0,3,2.5,Stanwood,2083.0,10019.0,2018.0,4.0,209.0,139.66666666666666,Active,0,0,http://www.redfin.com/WA/Stanwood/28107-85th-Dr-NW-98292/home/2867442,Fizber.com,4962962,N,Y,48.2510598,-122.34826640000001,"Description: Candle Ridge home for sale. View of Olympics, Port Susan, and Skagit Bay. 3 Bed/2.5 Bath. .23 acre lot backing on common land/greenbelt on two sides. 2 door/3 Bay garage with extra storage or shop. New natural gas furnace and hot water heater. Low maintenance Hardiplank siding. Automatic sprinkler system. Relax on the front porch, take in incredible sunsets, or BBQ on the back patio. Easy access to both country and shopping. Choose from multiple routes to walk, jog, or bike to convenient grocery stores including Grocery Outlet, coffee shops, cafes, local shopping, and thrift stores. Safe streets for evening strolls to refresh your spirit. Will negotiate with or without buyer's agents. $435,000 - Bring buyers & offers. The only contacts accepted will be agents representing actual buyers. Investors: HOA only allows hardship rentals. Open and bright home and property. Plenty of room to play and entertain. Common area on two sides. Safe community. Walking and biking loops. Panoramic fireworks from the second story windows on the 4th of July. Garden spaces. Apples, strawberries, raspberries, cherries, plums, apricots, pears. .. Enough to fill two freezers and share with neighbors and food banks. Each year has a different bumper crop to harvest.",192
193,For-Sale-by-Owner Listing,,Single Family Residential,28201 Nordic Way,Stanwood,WA,98292,439000.0,3,2.0,Stanwood,2136.0,11761.0,2018.0,236.0,206.0,100.0,Active,0,0,http://www.redfin.com/WA/Stanwood/28201-Nordic-Way-98292/home/2868569,Fizber.com,4932887,N,Y,48.2522599,-122.3489297,"Description: Don't miss this meticulously maintained rambler in Stanwood's Pioneer Hills neighborhood. Enjoy mountain and sound views from the living room and formal dining room. Situated on a large corner lot with a huge open area between you and your neighbors. You'll enjoy coming home to this well designed, flowing floor plan. The large master suite is it's own wing on one side of the house. The large, partially covered deck is great for entertaining, or relaxing in the professionally landscaped yard. Views of the lake and surrounding mountains can be seen from most every room in the home.",193
194,MLS Listing,,Vacant Land,180 SE 224th St,Kent,WA,98042,195000.0,0,2.74247311827957,Lake Youngs,2756.496788008565,275735.0,2018.0,53.0,343.97072072072075,139.66666666666666,Active,0,0,http://www.redfin.com/WA/Maple-Valley/180-SE-224th-St-98042/home/104490188,NWMLS,1264799,N,Y,47.400343,-122.10025800000001,"Beautiful, Private 6+ acres for your custom home * * In the Tahoma School District. Area of high end homes on 5 acre lots. Power is on the property. Wetland delineation, Topography map, and survey complete. All the hard work has been done. Asphalt road to the property.",194
195,MLS Listing,,Vacant Land,298 148th Ave SE,Kent,WA,98042,174950.0,0,2.74247311827957,Kent,2756.496788008565,198198.0,2018.0,54.0,343.97072072072075,139.66666666666666,Active,0,0,http://www.redfin.com/WA/Kent/298-148th-Ave-SE-98042/home/109262033,NWMLS,1265402,N,Y,47.333079999999995,-122.144333,"Thinking of building your custom dream home on the Kent/Auburn border? This nearly 5 acre lot is easily accessible to Hwy 18, is nice and level for an easier build. Lot has gorgeous, mature trees, irrigation tanks and a tranquil spring-truly a country-like setting so close to city amenities. Bring your plans, your animals and your imagination!!",195
196,MLS Listing,,Vacant Land,28625 176th Ave SE,Kent,WA,98042,89000.0,0,2.74247311827957,Covington,2756.496788008565,16117.0,2018.0,60.0,343.97072072072075,139.66666666666666,Active,0,0,http://www.redfin.com/WA/Covington/28625-176th-Ave-SE-98042/home/22695424,NWMLS,1261425,N,Y,47.344901,-122.10778,"Covington 16,117 sq ft lot. Fantastic building site for your custom or manufactured home. Rambler or two story. Sits up high looking out over the area. Mostly cleared and ready for you to build. Water meter on site, power and phone in street. Septic design expired, but should be simple to get a new one. Geotech report, clos in to Covington, Hwy 18 for easy access to shopping and commute to work. No sign yet.",196
197,MLS Listing,,Single Family Residential,25801 207th (Lot 116) Place SE,Covington,WA,98042,594950.0,5,2.75,Covington,2869.0,5000.0,2018.0,66.0,207.0,50.0,Active,May-21-2018 11:00 AM,May-21-2018 06:00 PM,http://www.redfin.com/WA/Covington/25801-207th-Pl-SE-98042/home/109969409,NWMLS,1259696,N,Y,47.3710095,-122.0650164,"Presenting The Geneva ~ Extra large living area opens to a massive, fully functional 5 piece Gourmet Kitchen w/ slab stone counters. ~ Main floor Guest-Suite and bath off the entry. Watch the sunset from your cozy covered patio with outdoor brick fireplace. Desirable details such as luxury plank flooring, modern gas fireplace & luxurious Master Suite w/ 5 piece spa-like bath. Fully fenced/landscaped back yard for your privacy & enjoyment. This home will be move-in ready by May!",197
198,MLS Listing,,Single Family Residential,25719 207th (Lot 118) Place SE,Covington,WA,98042,574950.0,4,2.5,Covington,2703.0,5000.0,2018.0,66.0,213.0,50.0,Active,May-21-2018 11:00 AM,May-21-2018 06:00 PM,http://www.redfin.com/WA/Covington/25719-207th-Pl-SE-98042/home/109969348,NWMLS,1259674,N,Y,47.3712972,-122.06528899999999,"May 2018 move-in! Popular Clark floor plan with great room & dining room that opens up to a covered outdoor living room w/ gas fireplace. Picture windows let light shine on elegant surfaces such as slab counters, luxury plank flooring, gas fireplace. Upgraded with Gourmet kitchen, A/C prewire, spa-like 5 piece master bath with soaking tub and enormous walk-in closet. Includes french door refrigerator & Maytag Washer/Dryer.",198
199,MLS Listing,,Single Family Residential,13506 SE 272nd St,Kent,WA,98042,425000.0,6,1.5,Kent,1840.0,45738.0,2018.0,66.0,231.0,139.66666666666666,Active,0,0,http://www.redfin.com/WA/Kent/13506-SE-272nd-St-98042/home/400816,NWMLS,1259435,N,Y,47.358416299999995,-122.1612389,"Great Location with Lake Meridian nearby. Close to freeway access and shopping. House Vacant. ""Builder Alert"" Excellent Development Opportunity in Kent, WA (Lake Meridian Area). The property is zoned SR-6 by City of Kent. 1 Acre (45,738 Sq. Ft). Driveway connects to 272nd with side walks in place, with gas and sewer available in the street. Electric and water on the property. Pictures of property show the land and surrounding area from a Drone overhead.",199
200,MLS Listing,,Single Family Residential,13308 SE 262nd St,Kent,WA,98042,699950.0,5,2.75,Lake Meridian,3496.0,6457.0,2018.0,73.0,200.0,139.66666666666666,Active,0,0,http://www.redfin.com/WA/Kent/13308-SE-262nd-St-98042/home/22496052,NWMLS,1255263,N,Y,47.3668429,-122.16393190000001,"Chateau Meridian immaculate Contemporary 5 Bedroom house. Beautiful hardwood floors throughout main. Light and Bright open great room concept with gas fireplace, stainless steel appliances, quartz countertops and walk-in pantry. Guest suite on main. Master with ensuite, private deck, and walk-in closet. 3 additional bedrooms with walk-in closets. Fully-fenced backyard with deck and Freshly planted fruit trees. 2-car attached garage. Close to freeways, amenities, and Kent Station.",200
201,MLS Listing,,Single Family Residential,23812 160th Ave SE,Kent,WA,98042,2475000.0,6,6.75,Lake Youngs,11299.0,207857.0,2018.0,76.0,219.0,139.66666666666666,Active,0,0,http://www.redfin.com/WA/Kent/23812-160th-Ave-SE-98042/home/393677,NWMLS,1251404,N,Y,47.3883326,-122.1274628,"Private gated estate with Mt. Rainier views on 5 acres of meticulously landscaped grounds. A true retreat, boasting high-end appliances & finishes throughout - perfect for indoor/outdoor entertaining. Featuring an exercise pavilion w/ full racketball court, indoor pool & sauna, yoga room, full ADU, 8-car garage, playground, garden, gazebo and more. Opportunity to purchase 5 acre vacant lot next door MLS 1286461 & own all 10 acres to create the ultimate equestrian sanctuary or private compound.",201
202,MLS Listing,,Single Family Residential,25719 209th Lp SE,Covington,WA,98042,775500.0,3,2.5,Covington,2784.0,7855.0,2018.0,80.0,279.0,52.0,Active,0,0,http://www.redfin.com/WA/Covington/25719-209th-Loop-SE-98042/home/109661273,NWMLS,1252704,N,Y,47.3712086,-122.0634561,"The LANGLEY rambler w/ bonus by Garrette Custom Homes. This home is a corner homesite surrounded by open space in the Maple Hills community. GPS to front of project: 26027 204th Ave SE, Covington, WA 98042. First floor Master Suite, with open Great Room/Gourmet Kitchen w/ dbl ovens & 36"" gas cook-top w/ granite. Additional 2 beds on main floor, 3-car Garage & covered deck.",202
203,MLS Listing,,Mobile/Manufactured Home,31174 E Lake Morton Dr SE,Kent,WA,98042,272000.0,3,2.0,Lake Morton,1550.0,98470.0,2018.0,81.0,175.0,139.66666666666666,Active,0,0,http://www.redfin.com/WA/Kent/31174-E-Lake-Morton-Dr-SE-98042/home/2110589,NWMLS,1250744,N,Y,47.3223494,-122.07809909999999,"Value in Land! Build your dream home on this lovely treed, serene, private & peaceful 2.25+ acres w/ utilities on site, in beautiful Lake Morton community. 3 bed/2 bath manufactured home livable with some repairs. Property features RV parking, oversized 2 car garage w/ work bench, compressor & attached carport for added parking means room for all your toys. Circular driveway for easy use of space. Public boat launch & fishing just down the street! Minutes to amenities & freeway. WELCOME HOME!",203
204,MLS Listing,,Vacant Land,18259 SE 272nd St,Kent,WA,98042,1495000.0,0,2.74247311827957,Covington,2756.496788008565,66646.0,2018.0,81.0,343.97072072072075,139.66666666666666,Active,0,0,http://www.redfin.com/WA/Kent/18259-SE-272nd-St-98042/home/371910,NWMLS,1252006,N,Y,47.3572435,-122.09729740000002,"Ideal location for investor planning to convert existing use to a more suitable venture. Buyer may apply for conditional use permit/variance to provide use for commercial purpose (or Storage Units?) Across SE 272nd from established shopping center destination. Home Depot is directly opposite inside. Buyer to verify suitability for intended purpose. Permits, variance, or conditional use permit are the buyer's responsibility. Buyer to do all research regarding County regs/ permits. 186' frontage.",204
