478,MLS Listing,,Single Family Residential,4928 226th Place NE,Arlington,WA,98223,869950.0,5,6.5,Eagle Ridge,4627.0,220414.0,2018.0,263.0,188.0,92.0,Active,0,0,http://www.redfin.com/WA/Arlington/4928-226th-Pl-NE-98223/home/2465205,NWMLS,1187059,N,Y,48.2046036,-122.1613152,"This quality custom built home in private gated community is amazing. Open floorplan, all 5 bdrms have attached baths and walk in closets making this the perfect home for communal living. Huge covered deck w/ fantastic view is also accessible from main floor master suite. The gourmet kitchen is a chefs dream with SS appliances & walk-in pantry. Office with separate entrance makes working from home a breeze. Too many extras to list, all within 5 mins of I-5. 1 yr Home Warranty provided.",478
479,MLS Listing,,Single Family Residential,12715 240th St NE,Arlington,WA,98223,725000.0,3,2.75,Arlington Heights,3327.0,305356.0,2018.0,293.0,218.0,139.66666666666666,Active,0,0,http://www.redfin.com/WA/Arlington/12715-240th-St-NE-98223/home/143064816,NWMLS,1170919,N,Y,48.214337,-122.056625,"Do you need room to spread out & enjoy the beautiful countryside? Look no further! Plenty of flat useable land here for farming, equestrian or entertaining. This unique 3327 sq ft home has a custom 2 sided fireplace & lots of windows to see the outside beauty. There is lots of storage areas, barn and 2 other outbuildings. RV pad with it's own electric & septic. Enjoy a steam shower or sauna at the end of the day then kick your heals up to relax. New well has been installed.",479
480,MLS Listing,,Vacant Land,1 Russian Rd,Arlington,WA,98223,285000.0,0,2.74247311827957,Jordan Road,2756.496788008565,6969600.0,2018.0,299.0,343.97072072072075,139.66666666666666,Active,0,0,http://www.redfin.com/WA/Arlington/1-Russian-Rd-98223/unit-1/home/28482581,NWMLS,1167551,N,Y,48.137423999999996,-121.993233,160+/- acres located just north of Granite Falls. Young plantation on about 30 acres. Expansive territorial views including views of the Olympics and Puget Sound. Enjoy your privacy with access to all the amenities afforded by the city. Current access is for timber management only - cannot build a residence. Access via locked gates. Buyer to verify all information to own satisfaction.,480
481,MLS Listing,,Single Family Residential,19920 43rd Ave NE,Arlington,WA,98223,999950.0,4,2.75,Arlington,2600.0,264845.0,2018.0,311.0,385.0,139.66666666666666,Active,0,0,http://www.redfin.com/WA/Arlington/19920-43rd-Ave-NE-98223/home/11882017,NWMLS,1161446,N,Y,48.176836,-122.178294,"The Ponderosa is for sale & the Cartwright's are moving, now is your chance to bring in your herd!This exquisite horse ranch has it all from the amazing 4 bedrooms to the top-notch barn this place is sure to please your pickiest buyer!You will be driving over a small bridge to get to this one of a kind gem, property & home features:6 usable acres, barn with 11 stalls, heated tack room +3/4 bath, in door/outdoor arena, breathtaking waterfall, floor to ceiling stone fireplace & a dramatic mountain view",481
482,MLS Listing,,Vacant Land,27422 Lake Riley Rd,Arlington,WA,98223,179950.0,0,2.74247311827957,Jim Creek,2756.496788008565,217800.0,2018.0,314.0,343.97072072072075,139.66666666666666,Active,0,0,http://www.redfin.com/WA/Arlington/27422-E-Lake-Riley-Rd-98223/home/141676570,NWMLS,1156103,N,Y,48.244435700000004,-121.94251200000001,"Listed as vacant land but has old home that was once part of Alderwood Manor Countryside Hotel & was moved to site. Current permits are for turning building into shop. Building sits in private setting w/ beautiful surrounding mountain views. There is permitted 2 bdr septic system installed on site. (not yet hooked up) Recent Boundary Line Adj. so county map not current, map attached. Locked gate so bring agent . Also attached engineer report, permits, etc. Owner terms 20% down, 10 C/O, 15 yr amm.",482
483,MLS Listing,,Vacant Land,16100 Jordan Trail Rd,Arlington,WA,98223,30000.0,0,2.74247311827957,Jordan Ridge/River,2756.496788008565,15246.0,2018.0,318.0,343.97072072072075,139.66666666666666,Active,0,0,http://www.redfin.com/WA/Arlington/16100-Jordan-Trails-Rd-98223/home/140551735,NWMLS,1157065,N,Y,48.142523700000005,-122.0413524,"JORDAN RIVER TRAILS:A week-end get-away visit, or a lifetime opportunity. Perfect topo for daylight bsmt/corner lot Utilities in street. Build your custom home or bring manufactured home. Walk to the park, barn and cabana, Entrance to private riverfront beach access just a stone's through away. Great neighborhood with club house, party events, playground, pool, etc. ALL WITH RIVER/Fishing ACCESS! Launch the Minnow, Skipper! -2 hours north of Seattle. Excellent investment, or 2nd home retreat.",483
484,MLS Listing,,Vacant Land,16020 State Route 530 NE,Arlington,WA,98223,250000.0,0,2.74247311827957,Arlington,2756.496788008565,953964.0,2018.0,334.0,343.97072072072075,139.66666666666666,Active,0,0,http://www.redfin.com/WA/Arlington/16020-State-Route-530-NE-98223/home/129342265,NWMLS,1148577,N,Y,48.265451,-122.01251299999998,"* PRICE REDUCED * * WATERFRONT PROPERTY * Get away from the city without giving it up. Remote, yet close to amenities: 5 mins to Oso, 10 to Arlington, 15 to I-5 through countryside. 900' on the N. Fork Stillaguamish River (Great Fishing) with private access. Partially cleared for your custom home with 180 degree breath-taking views of the mountains and river. Power & well installed, 4-bedrom septic plan avail (not installed). County acreage not updated to 21.9 - Survey supports . Buyer to verify all",484
485,MLS Listing,,Vacant Land,22106 123rd Ave NE,Arlington,WA,98223,670000.0,0,2.74247311827957,Arlington Heights,2756.496788008565,1445756.0,2018.0,356.0,343.97072072072075,139.66666666666666,Active,0,0,http://www.redfin.com/WA/Arlington/22106-123rd-Ave-NE-98223/home/114062316,NWMLS,1133818,N,Y,48.1961871,-122.0642493,Great opportunity for investors and builders to develop into large acreage estates! Nice level land with beautiful mountain and territorial views! Property to be sold with tax parcel # 31060500300500 for a total of 53.19 acres,485
486,MLS Listing,,Vacant Land,Lake Cavanaugh Rd,Arlington,WA,98223,99000.0,0,2.74247311827957,Arlington,2756.496788008565,494406.0,2018.0,359.0,343.97072072072075,139.66666666666666,Active,0,0,http://www.redfin.com/WA/Arlington/Lake-Cavanaugh-Rd-98223/home/113149384,NWMLS,1133493,N,Y,48.274644,-121.93141200000001,Fabulous waterfront acreage! Own your own piece of paradise. Large Old Growth Cedar trees. Some area already cleared. 768 Ft of no bank waterfront located on Deer Creek. Walking and riding trails. Located close to the OSO General Store. Too many possibilities to list. Come see for yourself! Property is located outside the 100-500 year flood zone.,486
487,MLS Listing,,Vacant Land,40702 X Highway 530,Arlington,WA,98223,100000.0,0,2.74247311827957,Squire Creek,2756.496788008565,479160.0,2018.0,395.0,343.97072072072075,139.66666666666666,Active,0,0,http://www.redfin.com/WA/Arlington/40702-Washington-530-98223/home/113757669,NWMLS,1109786,N,Y,48.2692537,-121.68126509999999,Apx. 11 acres located on the north side of 530 across the highway from 41703 SR 530. There is a asphalt apron at site and an overgrown road bed below it. Marketable timber on site and potential for great mountain views with some clearing. Located just past Squire Creek Campground. Property will be assigned a new tax number and lot status. Currently part of larger acreage that spans both sides of HY 530. Highway creates natural division of property.,487
488,MLS Listing,,Vacant Land,18532 Jordan Rd,Arlington,WA,98223,149950.0,0,2.74247311827957,Arlington,2756.496788008565,105851.0,2018.0,396.0,343.97072072072075,139.66666666666666,Active,0,0,http://www.redfin.com/WA/Arlington/18532-Jordan-Rd-98223/home/2563436,NWMLS,1106382,N,Y,48.164207,-122.06364099999999,"Build your dream home on this LARGE RIVERFRONT LOT! Over 2 ac. with beautiful setting, septic, well, and power are already in. 949 sf. 2-bedroom, 2-baths manufactured home on lot is no longer viable. Value in land.",488
489,MLS Listing,,Vacant Land,20114 Old Burn Rd,Arlington,WA,98223,115000.0,0,2.74247311827957,Arlington,2756.496788008565,83645.0,2018.0,402.0,343.97072072072075,139.66666666666666,Active,0,0,http://www.redfin.com/WA/Arlington/20114-Old-Burn-Rd-98223/home/109004971,NWMLS,1105602,N,Y,48.17897,-122.11936599999999,"APPROVED 4 bedroom Septic Design. BUILD YOUR DREAM HOME on this 1.9 ACRE LOT in neighborhood of high end homes. This lot has great views of the mountains, perfect for daylight rambler. Situated within City of Arlington Zoning. Electric & PUD Water are in the street. Arlington School District. Buyer to verify all information to their satisfaction. CLOSE TO DOWNTOWN, 5 min to HWY 9, 12 MIN TO I-5.",489
490,MLS Listing,,Vacant Land,9813 Moran Rd NE,Arlington,WA,98223,999999.0,0,2.74247311827957,Arlington,2756.496788008565,804118.0,2018.0,490.0,343.97072072072075,139.66666666666666,Active,0,0,http://www.redfin.com/WA/Arlington/9813-Moran-Rd-98223/home/2514770,NWMLS,1067807,N,Y,48.18918,-122.098013,"This property has preliminary plat approval for a 8 lot Rural Cluster with most lots sharing a view of the Stillaguamish River below. The existing residence is in need for repairs to bring it back to its original estate elegance. It has 7 bdrms, 6 ba, guest house, attached and detached garages and a large workshop. 4,784 SF overlooking the Stilly River below. This is a great project for the experienced builder/developer. Home is on lock box will be sold with tax#31051200401100. Owned by the LA.",490
491,MLS Listing,,Vacant Land,7423 204th St NE Unit D,Arlington,WA,98223,500000.0,0,2.74247311827957,Arlington,2756.496788008565,29978.0,2018.0,500.0,343.97072072072075,139.66666666666666,Active,0,0,http://www.redfin.com/WA/Arlington/7423-204th-St-NE-98223/unit-D/home/112862404,NWMLS,1064758,N,Y,48.181309000000006,-122.12986409999998,"Attention Developers! Build next to Bartell Drugstore New Location in Arlington. Land Frontage on Busy 204th & Hwy 9. Heavy Traffic Location Across from Safeway, Chevron, McDonalds & Park 77 NEW Luxory Condos and so much more! Storm Drain & All Utilities on the Site. Ready to Build on. ZONED GC–General Commercial with Retail Overlay allowing a vast array of retail and business opportunities. The GC Zoning District also abuts to an area zoned RHD–Residential High Density for large multi-family.",491
492,MLS Listing,,Vacant Land,16612 51st Ave NE,Arlington,WA,98223,1975000.0,0,2.74247311827957,Smokey Point,2756.496788008565,887753.0,2018.0,674.0,343.97072072072075,139.66666666666666,Active,0,0,http://www.redfin.com/WA/Arlington/16612-51st-Ave-NE-98223/home/2605713,NWMLS,978728,N,Y,48.147597,-122.164442,"Land Value. Appx 20 Ac General Commercial Zoning in City Limits, 1.5 mi from I-5 Exit 206 via three signal intersections. As of 12/2017 zoning has Mixed Use Overlay to also allow residential projects. Appx 700 ft of frontage on 51st Ave NE and appx 1262 ft depth. City of Marysville Water and Sewer lines IN THE STREET, hook up OK via permits. Value in the Land. Near Arlington Airport, shopping, restaurants, lodging, medical & emergency services and Military Support Complex and I-5 Exit 206.",492
493,MLS Listing,,Vacant Land,NNA 124th St NE,Arlington,WA,98223,99950.0,0,2.74247311827957,Sisco Heights,2756.496788008565,392911.0,2018.0,756.0,343.97072072072075,139.66666666666666,Active,0,0,http://www.redfin.com/WA/Arlington/NNA-124th-St-NE-98223/home/105415355,NWMLS,931494,N,Y,48.107738,-122.108322,* * HUGE PRICE DROP * * Terrific 9.02 acres in 2 separate tax parcels that MUST be sold together. #30051200100100 is 4.45 acres on the road and back parcel #3005120010200 is 4.57 acres but has NO LEGAL easement. Mostly level and private. Property needs well and septic. Bring your ideas and your builder !!! * * please do not trespass on the neighbors property to access the site,493
494,MLS Listing,,Vacant Land,11914 169th Dr NE,Arlington,WA,98223,45000.0,0,2.74247311827957,Rainbow Springs,2756.496788008565,8712.0,2018.0,1010.0,343.97072072072075,139.66666666666666,Active,0,0,http://www.redfin.com/WA/Arlington/11914-169th-Dr-NE-98223/home/22088656,NWMLS,835044,N,Y,48.104721000000005,-122.00564299999999,"Waterfront property in a nice gated community, next to the community park. Serene lake great for canoeing and recreational fishing. Bring an RV and camp out. Electric on property, water in street. Land survey is complete, property corners marked.",494
495,MLS Listing,,Single Family Residential,9515 N Cedarvale Loop Rd,Arlington,WA,98223,790000.0,3,2.0,Grandview,3164.0,871200.0,2005.0,1141.0,250.0,139.66666666666666,Active,0,0,http://www.redfin.com/WA/Arlington/9515-N-Cedarvale-Loop-Rd-98223/home/73765918,NWMLS,766093,N,Y,48.27576320000001,-122.1004405,"Secluded Wilderness ""Above the Clouds"". Incredibly special, 20 ""no neighbor"" Acres on Stimson Ridge. Panoramic views of Mt. Rainier, Olympics, Puget Sound, sunsets & everything in-between. Miles & Miles of private road access to several view sites for Hiking, ATV's, Horseback riding, Camping, Hunting etc. Year-round creek fed Pond with 20"" Trout. Literally 12 minutes to Arlington or I-5. Ideally located. Custom 1-Owner spacious Rambler built to take it all in. Even a Barn.",495
496,MLS Listing,,Vacant Land,N Macleod Ave,Arlington,WA,98223,125000.0,0,2.74247311827957,Arlington,2756.496788008565,4363.0,2018.0,1773.0,343.97072072072075,139.66666666666666,Active,0,0,http://www.redfin.com/WA/Arlington/N-Macleod-Ave-98223/home/55529814,NWMLS,516278,N,Y,48.196383000000004,-122.12532399999999,"Zoning may possibly allow for multi-family, office space/commercial retail, located in downtown Arlington. Plans are available.",496
497,MLS Listing,,Vacant Land,29608 124th Ave NE,Arlington,WA,98223,109000.0,0,2.74247311827957,Arlington,2756.496788008565,217800.0,2018.0,1853.0,343.97072072072075,139.66666666666666,Active,0,0,http://www.redfin.com/WA/Arlington/29608-124th-Ave-NE-98223/home/77494535,NWMLS,477310,N,Y,48.264864,-122.064,"Beautiful 5 acre view site, E of Bryant Store on Hwy 9, nicely timbered with Evergreens Community Water available. Owner financing, private and septic setting of country homes on Acreage Dead End Street, Mountain and territorial views. Excellent Building site, buy now on owner terms and build later.",497
498,MLS Listing,,Vacant Land,29631 124th Ave NE,Arlington,WA,98223,119000.0,0,2.74247311827957,Arlington,2756.496788008565,221700.0,2018.0,1853.0,343.97072072072075,139.66666666666666,Active,0,0,http://www.redfin.com/WA/Arlington/29631-124th-Ave-NE-98223/home/77494534,NWMLS,477313,N,Y,48.264495000000004,-122.060073,"Beautiful 5 acre view site, E of Bryant Store on Hwy 9, nicely timbered with Evergreens Community Water available. Owner financing, private and septic setting of country homes on Acreage Dead End Street, Mountain and territorial views. Excellent Building site, buy now on owner terms and build later.",498
499,MLS Listing,,Single Family Residential,1845 S 264th Place,Des Moines,WA,98198,424900.0,5,1.75,Des Moines,2040.0,8145.0,2018.0,23.0,208.0,139.66666666666666,Active,0,0,http://www.redfin.com/WA/Des-Moines/1845-S-264th-Pl-98198/home/203131,NWMLS,1266264,N,Y,47.3644247,-122.3088932,"New Roof, New Deck, New Exterior Paint. Double Pane Windows. Detach 400 sqft workshop w/ loft +storage sheds in fully fenced & level backyard w/ patio. Ideal MIL or Daycare/Home Office 2040 sq ft Floor Plan. 5 bedrooms, 1.75 bath. Hardwoods. Tons of natural light! Rec Room. Convenient, near 272nd transit, Pac Hwy, I-5, & 509. Elem school 1 block away. Library 3 blocks. 2 fireplaces, built in book shelf. Carport Gas forced air heat. Near popular Redondo & Des Moines Marina & Saltwater State Park!",499
500,MLS Listing,,Single Family Residential,23304 12th Place S #4,Des Moines,WA,98198,749950.0,4,1.75,Des Moines,2802.0,7952.0,2018.0,24.0,268.0,45.0,Active,0,0,http://www.redfin.com/WA/Des-Moines/Unknown-Unknown/home/145530067,NWMLS,1282268,N,Y,47.4017661,-122.32429009999998,"JK Monarchs Newest Luxury Home Community, The Pinnacles at DesMoines. 22contemporary residences perched atop a ridge allowing upper homesites western Sound Views. Experience the ultimate in Puget Sound Lifestyle w nearby access to the waterfront city of DesMoines along w marinas & NW restaurants. The floor plans reflect Modern styling & exquisite finishes creates livability/style. Dbl Suites Easy commute to I-5, min to Seattle-Tacoma International Airport affords convenient global access. Lt 4",500
501,MLS Listing,,Condo/Co-op,21925 7Th Ave S Unit A103,Des Moines,WA,98198,249999.0,2,1.5,Downtown Des Moines,981.0,55605.0,2018.0,24.0,255.0,395.0,Active,0,0,http://www.redfin.com/WA/Des-Moines/21925-7th-Ave-S-98198/unit-A103/home/55550,NWMLS,1269498,N,Y,47.4049872,-122.32655940000001,"Fantastic location in the heart Des Moines! Enjoy the lifestyle & atmosphere of the waterfront community, walk to Marina, Beach, Park, Restaurants, shops! Delightful Condo with lobby entrance, secure pkg garage & storage. One level, spacious open living rm w/ fpl. Updated Kitchen with white cabinets, pass thru to dining; utility rm adj to kit. slider to private lanai(length of condo)--entertain, BBQ's, gardening. Continental bth, mstr bdrm w/ lg dressing rm w/ closets, double sinks, cabinets.",501
502,MLS Listing,,Single Family Residential,1328 S 232nd St,Des Moines,WA,98198,625000.0,6,2.75,Des Moines,2630.0,38020.0,1942.0,24.0,238.0,139.66666666666666,Active,0,0,http://www.redfin.com/WA/Des-Moines/1328-S-232nd-St-98198/home/201158,NWMLS,1276464,N,Y,47.394058,-122.3159967,"You will enjoy the many features and space in this 6 bedroom 2.75 bath home that has large vaulted area that includes a Living rm w/ fireplace Kitchen with ample cabinets and gas range and a dining area. The master bedroom suite has a soaring ceiling and walk in closet. On the lower level there are 2 bedrooms a rec room and laundry room. There are vinyl windows throughout the home, new flooring and paint. A big front & back yard + huge wooded area a w/ creek sits on almost 1 acre. 2 car garage",502
503,MLS Listing,,Single Family Residential,1123 S 249th Place,Des Moines,WA,98198,349950.0,2,1.75,Huntington Park,1200.0,3052.0,2018.0,24.0,292.0,115.0,Active,0,0,http://www.redfin.com/WA/Des-Moines/1123-S-249th-Pl-98198/home/201309,NWMLS,1281714,N,Y,47.377915,-122.318408,"Come see this affordable rambler in the desirable 55+ community of Huntington Park. Enjoy a clubhouse, pool, walking trails, RV storage, activities and more! This 2 large bedroom, 1.75 bath boasts a spacious living room/dining room that opens onto a lovely deck - sheltered by the trees and shrubbery for privacy. Update it as time & money permit or have it all done before you even move in. A great investment, either way. 1-car garage offers storage space + 1 reserved parking space, too.",503
504,MLS Listing,,Condo/Co-op,28313 Redondo Wy S #208,Des Moines,WA,98198,415000.0,2,1.75,Redondo,1406.0,215657.3886554622,2018.0,26.0,295.0,500.0,Active,0,0,http://www.redfin.com/WA/Des-Moines/28313-Redondo-Way-S-98198/unit-208/home/11047,NWMLS,1280064,N,Y,47.3477095,-122.3223246,"Every day is a vacation when you enjoy sweeping views of Puget Sound & the Olympic Mts in this rambler style condo with a private tandem 2 car garage, outdoor pool, & cabana, all 1 block from the beach. In this Redondo condo you are part of a vibrant community with Salty's Restaurant & the Redondo Boardwalk, put your toes in the sandy beach or fish off the community dock. Redondo Ridge also has RV Parking for your boat or RV. HOA dues include water, sewer, garbage, cable, internet & gas FP.",504
505,MLS Listing,,Single Family Residential,24010 13th Place S,Des Moines,WA,98198,389950.0,3,1.5,Des Moines,1060.0,5000.0,2018.0,26.0,368.0,139.66666666666666,Active,0,0,http://www.redfin.com/WA/Des-Moines/24010-13th-Pl-S-98198/home/201524,NWMLS,1258400,N,Y,47.3863689,-122.3161875,"This beautiful home in Des Moines close to the waterfront is loaded with features. Upon entering the home you walk through a perfectly landscaped yard into the home that has flowing hardwood floors and large spacious rooms. The kitchen features new stainless steel appliances and quartz counters. With 3 bedrooms and 1.5 baths and updates your buyers can feel at home. Entertaining is a breeze with the backyard and covered large deck. Easy access to freeway, downtown and local attractions.",505
506,MLS Listing,,Condo/Co-op,22315 6th Ave S Unit A-101,Des Moines,WA,98198,475000.0,3,1.75,Des Moines Waterfront,1536.0,56639.0,2018.0,26.0,309.0,514.0,Active,0,0,http://www.redfin.com/WA/Des-Moines/22315-6th-Ave-S-98198/unit-A-101/home/2095487,NWMLS,1280186,N,Y,47.4013185,-122.32805570000001,"Rare Des Moines waterfront view home centrally located in downtown Des Moines overlooking the Marina. Panoramic, unobstructed view of Puget Sound & Olympic Mountains. Unbelievable sunsets & always something fun to watch! Desirable end unit on 1st floor. 1536 sq. ft, 3 Bedrooms & 2 Bathrooms. Radiant ceiling heat & natural gas fireplace! Private deck & 1 covered & extra uncovered for parking. Elevator for easy access and outdoor pool, too! Only a few feet to great restaurants of all types!",506
507,MLS Listing,,Single Family Residential,1235 S 273rd Place,Des Moines,WA,98198,990000.0,6,5.0,Woodmont,4600.0,8393.0,2018.0,29.0,215.0,139.66666666666666,Active,0,0,http://www.redfin.com/WA/Des-Moines/1235-S-273rd-Pl-98198/home/144237563,NWMLS,1275301,N,Y,47.357356700000004,-122.3179412,Gorgeous Contemporary new construction home w/ the finest materials & design. This Luxury Home is simply stunning. Soaring ceilings greet you as you enter the Great Room concept. With Territorial & Sound views to wake to each morning you have found paradise! The Chef's kitchen has all the bells & whistles. .. Your friends will be envious! Huge Owner Suite w/ a bath to die for. 3 covered balconies for sipping your morning coffee & drinking in the view. Workspace/living space down. Dare to dream!,507
508,MLS Listing,,Vacant Land,25316 22nd Ave S,Des Moines,WA,98198,849950.0,0,2.74247311827957,Des Moines,2756.496788008565,65512.0,2018.0,31.0,343.97072072072075,139.66666666666666,Active,0,0,http://www.redfin.com/WA/Des-Moines/25316-22nd-Ave-S-98198/home/202484,NWMLS,1278075,N,Y,47.3742971,-122.303519,"This 1.5 acre parcel can be divided into 6 lots. Seller has engineering approval to do so. Bond from he city is required to start infrastructure build up upon completion of which building permits can be issued. All utilities are available. Level property with no wetlands or geo-tech issues, residential zoned RS-7200. Previous short plat approval for 6 lots was approved in July 2016. Survey and other short plat documents are available. Great location, easy access to shopping, restaurants.",508
509,MLS Listing,,Single Family Residential,210 S 213th St,Des Moines,WA,98198,750000.0,4,2.5,North Hill,2050.0,9250.0,2018.0,32.0,366.0,139.66666666666666,Active,0,0,http://www.redfin.com/WA/Des-Moines/210-S-213th-St-98198/home/337158,NWMLS,1277527,N,Y,47.411233700000004,-122.33264679999999,"Views Views Views! Gorgeous Des Moines house has been totally renovated from a 1955 year old house to a 2018. Highly desirable bright & open floorplan, authentic wood floors & cozy fireplace. Kitchen features all new cabinets, counter-tops & SS appliances. Master bed has been completely redone to increase the height of the ceiling & has amazing views, as well as a brand new bathroom. New electrical & plumbing. Huge deck & patio with views of the sound is perfect for entertaining or relaxing!",509
510,MLS Listing,,Single Family Residential,23202 12th Place S #1,Des Moines,WA,98198,779950.0,4,3.25,Des Moines,3433.0,8165.0,2018.0,40.0,227.0,45.0,Active,0,0,http://www.redfin.com/WA/Des-Moines/Unknown-Unknown/home/145304832,NWMLS,1273218,N,Y,47.4017661,-122.32429009999998,"JK Monarchs Newest Luxury Home Community, The Pinnacles at DesMoines. 22 contemporary residences perched atop a ridge allowing upper homesites western Sound Views. Experience the ultimate in Puget Sound Lifestyle w nearby access to the waterfront city of DesMoines along w marinas & NW restaurants. The floor plans reflect Modern styling & exquisite finishes creates livability/style. Dbl Suites Easy commute to I-5, min to Seattle-Tacoma International Airport affords convenient global access. Lt 1",510
511,MLS Listing,,Single Family Residential,1116 S 244th Place,Des Moines,WA,98198,429000.0,2,1.75,Huntington Park,1410.0,4228.0,2018.0,40.0,304.0,115.0,Active,0,0,http://www.redfin.com/WA/Des-Moines/1116-S-244th-Pl-98198/home/201547,NWMLS,1270829,N,Y,47.382791999999995,-122.31901780000001,"Largest rambler available right now in the highly coveted 55+ community of Huntington Park (Age allowance for 40+ avail. ) Charming covered porch w/ partial water view. Tranquil setting & low maintenance landscaping. Many upgrades -custom wood shutters, fresh interior paint & new stainless steel appliances in kitchen. Updated bathrooms & spacious bedrooms. Large den-possible 3rd bedroom. Add'l storage loft in garage. Community features club house, organized events, pool/hot tub, library & trails.",511
